Name,Street,Block,Building,PostalCode,Description,PhotoURL,Latitude,Longitude
New Upper Changi Road Blk 208B,New Upper Changi Road,208B,,462208,A heartland hub serving delicious food and local comfort dishes.,http://www.nea.gov.sg/images/default-source/Hawker-Centres-Division/bedok-interchange-hawker-centre.jpg,1.324738845,103.9305605
New Upper Changi Road Blk 58,New Upper Changi Road,58,,461058,A beloved food centre known for diverse cuisines and friendly hawkers.,http://www.nea.gov.sg/images/default-source/Hawker-Centres-Division/resize_1262153263293.jpg,1.324187828,103.9411324
Newton Food Centre,Clemenceau Ave North,500,,229495,A landmark hawker market offering famous local favourites and snacks.,http://www.nea.gov.sg/images/default-source/Hawker-Centres-Division/resize_1262155777485.jpg,1.311892357,103.8395627
North Bridge Road Market,North Bridge Road,861,,198783,A family-friendly space filled with local charm and tasty hawker options.,http://www.nea.gov.sg/images/default-source/Hawker-Centres-Division/resize_1262155297184.jpg,1.305765378,103.863891
Old Airport Road Blk 51 (51 Old Airport Road Food Centre and Shopping Mall),Old Airport Road,51,,390051,A vibrant hawker space by the sea serving grilled and noodle dishes.,http://www.nea.gov.sg/images/default-source/Hawker-Centres-Division/resize_1262153198645.jpg,1.308251563,103.8858332
Pasir Panjang Food Centre,Pasir Panjang Road,121,,118543,A peaceful heartland market offering traditional dishes and friendly service.,http://www.nea.gov.sg/images/default-source/Hawker-Centres-Division/resize_1262155813373.jpg,1.275907525,103.7914027
Pasir Ris Central Hawker Centre,Pasir Ris Central,110,Pasir Ris Central Hawker Centre,519641,A central hawker centre bustling with diverse flavours and familiar faces.,http://www.nea.gov.sg/images/default-source/Hawker-Centres-Division/pasir-ris-central-hawker-centre.jpg,1.37343414,103.951543
Queen Street Blk 270 (Albert Centre),Queen Street,270,,180270,A lively and well-known market offering hearty and nostalgic meals.,http://www.nea.gov.sg/images/default-source/Hawker-Centres-Division/resize_1267850253199.jpg,1.301001465,103.8542116
Redhill Lane Blk 79 (Redhill Market),Redhill Lane,79,,150079,A famous food centre renowned for its diverse hawker favourites.,http://www.nea.gov.sg/images/default-source/Hawker-Centres-Division/resize_1262153664347.jpg,1.287858103,103.8184026
Sembawang Hills Food Centre (Jalan Leban Food Centre),Upper Thomson Road,590,,574419,A cultural food landmark known for its long queues and rich flavours.,http://www.nea.gov.sg/images/default-source/Hawker-Centres-Division/resize_1262155861677.jpg,1.37238494,103.8289942
Serangoon Garden Market,Serangoon Garden Way,49A,,555945,A vibrant hawker hub near the coast offering fresh and savoury meals.,http://www.nea.gov.sg/images/default-source/Hawker-Centres-Division/resize_1262156095817.jpg,1.36315712,103.8667375
Telok Blangah Drive Blk 82 (Telok Blangah Market),Telok Blangah Drive,82,,100082,A lively dual-level hawker centre offering modern comfort food.,http://www.nea.gov.sg/images/default-source/Hawker-Centres-Division/resize_1262153608307.jpg,1.273913799,103.8079436
Telok Blangah Rise Blk 36 (Telok Blangah Rise Market),Telok Blangah Rise,36,,90036,"A clean, community-driven hawker centre serving affordable eats.",http://www.nea.gov.sg/images/default-source/Hawker-Centres-Division/resize_1267858653663.jpg,1.272715797,103.8221173
Tiong Bahru Market,Seng Poh Road,30,,168898,A beloved heritage market with warm hawkers and timeless dishes.,http://www.nea.gov.sg/images/default-source/Hawker-Centres-Division/resize_1262156378375.jpg,1.285088258,103.8323488
Toa Payoh Lorong 1 Blk 127 (Toa Payoh West Market and Food Court),Lorong 1 Toa Payoh,127,,310127,A community spot offering home-style hawker food in a friendly setting.,http://www.nea.gov.sg/images/default-source/Hawker-Centres-Division/resize_1262154499803.jpg,1.338092686,103.8447316
Toa Payoh Lorong 4 Blk 74 (Toa Payoh Vista Market),Lorong 4 Toa Payoh,74,,310074,A well-loved hawker centre offering fresh ingredients and comfort food.,http://www.nea.gov.sg/images/default-source/Hawker-Centres-Division/resize_1262226848493.jpg,1.334548165,103.8519991
Toa Payoh Lorong 4 Blk 93,Lorong 4 Toa Payoh,93,,310093,A humble market with familiar dishes and heartland atmosphere.,http://www.nea.gov.sg/images/default-source/Hawker-Centres-Division/resize_1262154305312.jpg,1.338474752,103.8495135
Toa Payoh Lorong 5 Blk 75,Lorong 5 Toa Payoh,75,,310075,A nostalgic food centre known for its tasty and affordable fare.,http://www.nea.gov.sg/images/default-source/Hawker-Centres-Division/resize_1267878144152.jpg,1.336038822,103.8529416
Toa Payoh Lorong 7 Blk 22 (Kim Keat Palm Market and Food Centre),Lorong 7 Toa Payoh,22,,310022,A community favourite serving authentic Singaporean hawker classics.,http://www.nea.gov.sg/images/default-source/Hawker-Centres-Division/resize_1265168256123.jpg,1.335231459,103.857036
Toa Payoh Lorong 8 Blk 210,Lorong 8 Toa Payoh,210,,310210,"A peaceful, clean market surrounded by friendly neighbourhood energy.",http://www.nea.gov.sg/images/default-source/Hawker-Centres-Division/resize_1267876959422.jpg,1.340260835,103.8543953
Upper Boon Keng Road Blk 17 (Blk 17 Upper Boon Keng Market and Food Centre),Upper Boon Keng Road,17,,380017,A classic hawker hub with loyal customers and generations-old stalls.,http://www.nea.gov.sg/images/default-source/Hawker-Centres-Division/resize_1262226056435.jpg,1.315028044,103.8716203
Upper Cross Street Blk 531A (Hong Lim Food Centre and Market),Upper Cross Street,531A,,51531,A market filled with classic hawker dishes and heartwarming service.,http://www.nea.gov.sg/images/default-source/Hawker-Centres-Division/resize_1267878882405.jpg,1.2852464,103.8458189
West Coast Drive Blk 502 (Ayer Rajah Market),West Coast Drive,502,,120502,"A clean, cheerful hawker centre offering delicious local comfort food.",http://www.nea.gov.sg/images/default-source/Hawker-Centres-Division/resize_1265168297394.jpg,1.311889721,103.7591661
West Coast Drive Blk 503 (Ayer Rajah Food Centre),West Coast Drive,503,,120503,A modern community space where heritage and food come together.,http://www.nea.gov.sg/images/default-source/Hawker-Centres-Division/resize_1265168322420.jpg,1.31180301,103.7597513
Whampoa Drive Blk 90 (Whampoa Drive Makan Place/Whampoa Food Centre),Whampoa Drive,90,,320090,A family-friendly hawker centre surrounded by greenery and heartland life.,http://www.nea.gov.sg/images/default-source/Hawker-Centres-Division/resize_1262154207158.jpg,1.322943062,103.8551377
Whampoa Drive Blk 91/92 (Whampoa Drive Makan Place/Whampoa Market),Whampoa Drive,91/92,,320091,"A modern hawker hub in the heart of the city, serving a mix of traditional and contemporary delights.",http://www.nea.gov.sg/images/default-source/Hawker-Centres-Division/resize_1262154257763.jpg,1.323421751,103.8540681
Yishun Park Hawker Centre,Yishun Avenue 11,51,Yishun Park Hawker Centre,768867,A spacious food centre offering a variety of local favourites for the Marsiling community.,http://www.nea.gov.sg/images/default-source/Hawker-Centres-Division/yishun-hawker-centre.jpg,1.425017638,103.8447476
Yishun Ring Road Blk 104/105 (Chong Pang Market and Food Centre),Yishun Ring Road,104/105,,760104,A cozy and clean hawker centre known for nostalgic flavours and friendly hawkers.,http://www.nea.gov.sg/images/default-source/Hawker-Centres-Division/resize_1267438077554.jpg,1.431447688,103.8285376
